[
  {
    "event_id": "EVT-PH0-000001",
    "event_type": "Order.Received",
    "source": "Object Service",
    "subject": "SO-PH0-DEMO-001",
    "time": "2026-05-06T10:00:00+08:00",
    "schema_version": "1.0",
    "correlation_id": "CORR-PH0-DEMO-001",
    "causation_id": null,
    "actor": {
      "type": "human",
      "id": "SYSTEM_OWNER"
    },
    "payload": {
      "customer_order_id": "SO-PH0-DEMO-001",
      "customer_order_version": "V1"
    }
  },
  {
    "event_id": "EVT-PH0-000002",
    "event_type": "Quote.Proposed",
    "source": "Intake / DFM / Quote Agent",
    "subject": "QUO-PH0-DEMO-001",
    "time": "2026-05-06T10:30:00+08:00",
    "schema_version": "1.0",
    "correlation_id": "CORR-PH0-DEMO-001",
    "causation_id": "EVT-PH0-000001",
    "actor": {
      "type": "agent",
      "id": "INTAKE_DFM_QUOTE_AGENT"
    },
    "payload": {
      "decision_id": "DEC-PH0-QUOTE-001",
      "quote_level": "budget"
    }
  },
  {
    "event_id": "EVT-PH0-000003",
    "event_type": "OEP.Drafted",
    "source": "Package / Gate Agent",
    "subject": "OEP-PH0-DEMO-001",
    "time": "2026-05-06T11:30:00+08:00",
    "schema_version": "1.0",
    "correlation_id": "CORR-PH0-DEMO-001",
    "causation_id": "EVT-PH0-000002",
    "actor": {
      "type": "agent",
      "id": "PACKAGE_GATE_AGENT"
    },
    "payload": {
      "package_id": "OEP-PH0-DEMO-001",
      "status": "Draft"
    }
  }
]
